{"asset_id":"stalker_v1","checks":{"camera_readability":false,"cleanup_bounded":false,"functional_volume_present":false,"movable_parts_separable":false,"proportions_match_contract":false,"silhouette_readable":false},"decision":"pending","document_kind":"meshy_candidate_review","rejection_reasons":[],"reviewer":"unassigned","schema_version":"1.0.0","state":"pending","task_id":"01a063ae-9720-70ec-a5fb-65e22396282d"}
