{"asset_id":"biomass_human_arm_v1","checks":{"camera_readability":false,"cleanup_bounded":false,"functional_volume_present":false,"movable_parts_separable":false,"proportions_match_contract":false,"silhouette_readable":false},"decision":"pending","document_kind":"meshy_candidate_review","rejection_reasons":[],"reviewer":"unassigned","schema_version":"1.0.0","state":"pending","task_id":"01a0c0d5-5aba-7278-911e-c8c4d9e60848"}
